{
  "$schema": "https://json-schema.org/draft/2020-12/schema",
  "$id": "https://echelonfoundry.com/schemas/echelon.profile.v1.json",
  "title": "Echelon Environment Profile v1",
  "type": "object",
  "additionalProperties": false,
  "required": [
    "schema",
    "id",
    "version",
    "supportedPlatforms",
    "allowedReleaseStages",
    "components"
  ],
  "properties": {
    "schema": {
      "const": "echelon.profile/v1"
    },
    "id": {
      "type": "string",
      "pattern": "^[a-z][a-z0-9-]*$"
    },
    "version": {
      "type": "string",
      "pattern": "^(0|[1-9]\\d*)\\.(0|[1-9]\\d*)\\.(0|[1-9]\\d*)(?:-[0-9A-Za-z-]+(?:\\.[0-9A-Za-z-]+)*)?(?:\\+[0-9A-Za-z-]+(?:\\.[0-9A-Za-z-]+)*)?$"
    },
    "description": {
      "type": "string"
    },
    "extends": {
      "type": "array",
      "uniqueItems": true,
      "items": {
        "type": "object",
        "additionalProperties": false,
        "required": [
          "id",
          "version"
        ],
        "properties": {
          "id": {
            "type": "string",
            "pattern": "^[a-z][a-z0-9-]*$"
          },
          "version": {
            "type": "string",
            "pattern": "^(0|[1-9]\\d*)\\.(0|[1-9]\\d*)\\.(0|[1-9]\\d*)(?:-[0-9A-Za-z-]+(?:\\.[0-9A-Za-z-]+)*)?(?:\\+[0-9A-Za-z-]+(?:\\.[0-9A-Za-z-]+)*)?$"
          }
        }
      }
    },
    "supportedPlatforms": {
      "type": "array",
      "minItems": 1,
      "uniqueItems": true,
      "items": {
        "type": "string",
        "minLength": 1
      }
    },
    "allowedReleaseStages": {
      "type": "array",
      "minItems": 1,
      "uniqueItems": true,
      "items": {
        "enum": [
          "stable",
          "preview",
          "nightly"
        ]
      }
    },
    "components": {
      "type": "array",
      "items": {
        "$ref": "#/$defs/component"
      }
    },
    "capabilityPairings": {
      "description": "REG-PAIR-001 (spec/capability-pairing.md): a named capability that the host component's versions enable only together with the paired component's versions. Resolution fails when a set selects a host version inside host.range without a paired version inside requires.range, unless the catalog snapshot records the capability in disabledCapabilities.",
      "type": "array",
      "items": {
        "$ref": "#/$defs/capabilityPairing"
      }
    }
  },
  "$defs": {
    "component": {
      "type": "object",
      "additionalProperties": false,
      "required": [
        "systemId",
        "role",
        "required",
        "version"
      ],
      "properties": {
        "systemId": {
          "type": "string",
          "pattern": "^[a-z][a-z0-9-]*$"
        },
        "role": {
          "enum": [
            "host-tool",
            "host-daemon",
            "repository-lifecycle",
            "project-binding",
            "contract-bundle",
            "application"
          ]
        },
        "required": {
          "type": "boolean"
        },
        "version": {
          "type": "object",
          "additionalProperties": false,
          "minProperties": 1,
          "maxProperties": 1,
          "properties": {
            "exact": {
              "type": "string",
              "pattern": "^(0|[1-9]\\d*)\\.(0|[1-9]\\d*)\\.(0|[1-9]\\d*)(?:-[0-9A-Za-z-]+(?:\\.[0-9A-Za-z-]+)*)?(?:\\+[0-9A-Za-z-]+(?:\\.[0-9A-Za-z-]+)*)?$"
            },
            "range": {
              "type": "string",
              "minLength": 1
            }
          }
        },
        "allowedReleaseStages": {
          "type": "array",
          "minItems": 1,
          "uniqueItems": true,
          "items": {
            "enum": [
              "stable",
              "preview",
              "nightly"
            ]
          }
        }
      }
    },
    "capabilityPairing": {
      "type": "object",
      "additionalProperties": false,
      "required": [
        "id",
        "host",
        "requires"
      ],
      "properties": {
        "id": {
          "type": "string",
          "pattern": "^[a-z][a-z0-9-]*$"
        },
        "description": {
          "type": "string"
        },
        "evidence": {
          "type": "array",
          "items": {
            "type": "string",
            "minLength": 1
          }
        },
        "host": {
          "type": "object",
          "additionalProperties": false,
          "required": [
            "systemId",
            "range"
          ],
          "properties": {
            "systemId": {
              "type": "string",
              "pattern": "^[a-z][a-z0-9-]*$"
            },
            "range": {
              "type": "string",
              "minLength": 1
            }
          }
        },
        "requires": {
          "type": "object",
          "additionalProperties": false,
          "required": [
            "systemId",
            "range"
          ],
          "properties": {
            "systemId": {
              "type": "string",
              "pattern": "^[a-z][a-z0-9-]*$"
            },
            "range": {
              "type": "string",
              "minLength": 1
            }
          }
        }
      }
    }
  }
}
