{
  "schema": "echelon.profile/v1",
  "id": "echelon-current",
  "version": "1.32.0",
  "description": "Moving stable channel for the current Registry-approved Echelon repository environment. Version ranges select the newest compatible active stable releases from the channel catalog snapshot.",
  "supportedPlatforms": [
    "linux-x64",
    "linux-arm64",
    "osx-x64",
    "osx-arm64",
    "win-x64"
  ],
  "allowedReleaseStages": [
    "stable"
  ],
  "components": [
    {
      "systemId": "praxis",
      "role": "host-tool",
      "required": true,
      "version": {
        "range": ">=3.0.0 <4.0.0"
      }
    },
    {
      "systemId": "ordo",
      "role": "host-tool",
      "required": true,
      "version": {
        "range": ">=1.0.0 <2.0.0"
      }
    },
    {
      "systemId": "percepta",
      "role": "repository-lifecycle",
      "required": true,
      "version": {
        "range": ">=0.1.0 <1.0.0"
      }
    },
    {
      "systemId": "percepta-semantic",
      "role": "host-tool",
      "required": true,
      "version": {
        "range": ">=0.2.1 <1.0.0"
      }
    },
    {
      "systemId": "dokimos",
      "role": "repository-lifecycle",
      "required": true,
      "version": {
        "range": ">=0.2.0 <1.0.0"
      }
    },
    {
      "systemId": "visual-engineering",
      "role": "repository-lifecycle",
      "required": true,
      "version": {
        "range": ">=1.0.0 <2.0.0"
      }
    },
    {
      "systemId": "communication-engineering",
      "role": "repository-lifecycle",
      "required": true,
      "version": {
        "range": ">=1.0.0 <2.0.0"
      }
    },
    {
      "systemId": "tutela",
      "role": "repository-lifecycle",
      "required": true,
      "version": {
        "range": ">=0.1.0 <1.0.0"
      }
    },
    {
      "systemId": "aegis",
      "role": "project-binding",
      "required": true,
      "version": {
        "range": ">=1.0.0 <2.0.0"
      }
    },
    {
      "systemId": "limen",
      "role": "project-binding",
      "required": true,
      "version": {
        "range": ">=0.6.0 <1.0.0"
      }
    },
    {
      "systemId": "forma",
      "role": "project-binding",
      "required": true,
      "version": {
        "range": ">=0.3.0 <1.0.0"
      }
    },
    {
      "systemId": "folio",
      "role": "project-binding",
      "required": true,
      "version": {
        "range": ">=0.3.0 <1.0.0"
      }
    },
    {
      "systemId": "strata",
      "role": "repository-lifecycle",
      "required": false,
      "version": {
        "range": ">=0.1.1 <1.0.0"
      }
    },
    {
      "systemId": "arca",
      "role": "project-binding",
      "required": false,
      "version": {
        "range": ">=0.4.1 <1.0.0"
      }
    },
    {
      "systemId": "fides",
      "role": "project-binding",
      "required": false,
      "version": {
        "range": ">=0.1.0 <1.0.0"
      }
    },
    {
      "systemId": "summa-contracts",
      "role": "project-binding",
      "required": false,
      "version": {
        "range": ">=0.1.0 <1.0.0"
      }
    },
    {
      "systemId": "limen-fsharp",
      "role": "project-binding",
      "required": false,
      "version": {
        "range": ">=0.8.0 <1.0.0"
      }
    }
  ],
  "capabilityPairings": [
    {
      "id": "verified-completion-attested",
      "description": "Attested verified completion: Praxis 3.17.0 and later issues attested completion claims that only Dokimos 0.7.0 and later can verify (completion.verify-attested). Praxis 3.20.0 with Dokimos 0.6.0 refuses with VERIFIER_ATTESTATION_UNSUPPORTED.",
      "evidence": [
        "kemiller2002/indy-init-rehearsal-003 research/rehearsal-003-engineering-hardening.md section 7 (OBSERVED)",
        "spec/capability-pairing.md (REG-PAIR-001)"
      ],
      "host": {
        "systemId": "praxis",
        "range": ">=3.17.0"
      },
      "requires": {
        "systemId": "dokimos",
        "range": ">=0.7.0"
      }
    }
  ]
}
