{
  "schema": "echelon.profile/v1",
  "id": "indy-init",
  "version": "0.1.0",
  "description": "Pre-freeze Indy Init 2026 environment profile. Percepta and Forma are now pinned to cataloged stable releases; Aegis, Limen, and Folio remain unresolved until immutable stable package releases are cataloged.",
  "supportedPlatforms": [
    "osx-arm64",
    "linux-x64"
  ],
  "allowedReleaseStages": [
    "stable"
  ],
  "components": [
    {
      "systemId": "praxis",
      "role": "host-tool",
      "required": true,
      "version": {
        "exact": "3.6.0"
      }
    },
    {
      "systemId": "ordo",
      "role": "host-tool",
      "required": true,
      "version": {
        "exact": "1.4.0"
      }
    },
    {
      "systemId": "percepta",
      "role": "repository-lifecycle",
      "required": true,
      "version": {
        "exact": "0.1.0"
      }
    },
    {
      "systemId": "aegis",
      "role": "project-binding",
      "required": true,
      "version": {
        "range": ">=1.0.0 <2.0.0"
      }
    },
    {
      "systemId": "limen",
      "role": "project-binding",
      "required": true,
      "version": {
        "range": ">=0.6.2 <1.0.0"
      }
    },
    {
      "systemId": "forma",
      "role": "project-binding",
      "required": true,
      "version": {
        "exact": "0.3.0"
      }
    },
    {
      "systemId": "folio",
      "role": "project-binding",
      "required": true,
      "version": {
        "range": ">=0.3.0 <1.0.0"
      }
    }
  ]
}
